{
  "schema_version": "v1",
  "id": "tpl.base.v1.fullbody",
  "version": "1.0.0",
  "display_name": {
    "en": "Full Body Standard",
    "ko": "풀바디 표준",
    "ja": "フルボディ標準"
  },
  "intended_vibe": "캐릭터 전신 표현이 필요한 장면(코스튬 프리뷰, 댄스, 트레일러) 용 표준 템플릿. halfbody v1.3.0 의 상반신 골격을 승계하고 하반신(다리/발/치마/케이프/벨트) + 연관 2차 흔들림 물리 + 걸음걸이 기반 모션 슬롯을 추가한다. 저작 원칙은 halfbody 와 동일 — 정면 중심·넓은 얼굴 가동·ADR 0005 저작 게이트(physics-lint C1~C10) 통과.",
  "family": "fullbody",
  "canvas": { "width": 2048, "height": 4096 },
  "ratio": { "head_to_body": "1:6" },
  "parameters_file": "parameters.json",
  "parts_dir": "parts/",
  "deformers_file": "deformers.json",
  "physics_file": "physics/physics.json",
  "motions_dir": "motions/",
  "expressions_dir": "expressions/",
  "test_poses_file": "test_poses/validation_set.json",
  "lipsync_mapping": "../../shared/lipsync_mapping.v1.json",
  "physics_preset": "normal",
  "authoring": {
    "authors": [
      { "name": "geny-core", "role": "engineer", "contact": "core@geny.ai" }
    ],
    "created_at": "2026-04-19T00:00:00Z",
    "tool": "geny-internal@0.0.0"
  },
  "compat": {
    "motion_packs": [
      "idle.default@^1",
      "blink.auto@^1",
      "lipsync.mock@^1"
    ],
    "expression_packs": [
      "expression.smile@^1",
      "expression.wink@^1",
      "expression.neutral@^1"
    ],
    "physics": "physics.v1",
    "lipsync_mapping": "lipsync_mapping.v1.*",
    "export_targets_supported": [
      "cubism@5",
      "vtube_studio@1",
      "web-sdk@0.1",
      "psd@1"
    ]
  },
  "cubism_mapping": {
    "head_angle_x": "ParamAngleX",
    "head_angle_y": "ParamAngleY",
    "head_angle_z": "ParamAngleZ",
    "body_angle_x": "ParamBodyAngleX",
    "body_angle_y": "ParamBodyAngleY",
    "body_angle_z": "ParamBodyAngleZ",
    "body_breath": "ParamBreath",
    "arm_pose_variant": "ParamArmPoseVariant",
    "arm_l_angle": "ParamArmLAngle",
    "arm_r_angle": "ParamArmRAngle",
    "leg_l_angle": "ParamLegLAngle",
    "leg_r_angle": "ParamLegRAngle",
    "foot_l_angle": "ParamFootLAngle",
    "foot_r_angle": "ParamFootRAngle",
    "eye_open_l": "ParamEyeLOpen",
    "eye_open_r": "ParamEyeROpen",
    "eye_smile_l": "ParamEyeLSmile",
    "eye_smile_r": "ParamEyeRSmile",
    "eye_form_l": "ParamEyeLForm",
    "eye_form_r": "ParamEyeRForm",
    "eye_ball_x": "ParamEyeBallX",
    "eye_ball_y": "ParamEyeBallY",
    "eye_ball_form": "ParamEyeBallForm",
    "brow_l_y": "ParamBrowLY",
    "brow_r_y": "ParamBrowRY",
    "brow_l_x": "ParamBrowLX",
    "brow_r_x": "ParamBrowRX",
    "brow_l_angle": "ParamBrowLAngle",
    "brow_r_angle": "ParamBrowRAngle",
    "brow_l_form": "ParamBrowLForm",
    "brow_r_form": "ParamBrowRForm",
    "mouth_vowel_a": "ParamA",
    "mouth_vowel_i": "ParamI",
    "mouth_vowel_u": "ParamU",
    "mouth_vowel_e": "ParamE",
    "mouth_vowel_o": "ParamO",
    "mouth_up": "ParamMouthUp",
    "mouth_down": "ParamMouthDown",
    "hair_front_sway": "ParamHairFront",
    "hair_side_sway_l": "ParamHairSideL",
    "hair_side_sway_r": "ParamHairSideR",
    "hair_back_sway": "ParamHairBack",
    "hair_front_fuwa": "ParamHairFrontFuwa",
    "hair_side_fuwa_l": "ParamHairSideFuwaL",
    "hair_side_fuwa_r": "ParamHairSideFuwaR",
    "hair_back_fuwa": "ParamHairBackFuwa",
    "cloth_main_fuwa": "ParamClothMainFuwa",
    "cloth_skirt_sway": "ParamClothSkirtSway",
    "cloth_skirt_fuwa": "ParamClothSkirtFuwa",
    "cloth_cape_sway": "ParamClothCapeSway",
    "leg_sway_l": "ParamLegSwayL",
    "leg_sway_r": "ParamLegSwayR",
    "hip_phys": "ParamHipPhys",
    "overall_x": "ParamOverallX",
    "overall_y": "ParamOverallY",
    "overall_rotate": "ParamOverallRotate",
    "ahoge_sway": "ParamAhogeSway",
    "accessory_back_sway": "ParamAccessoryBackSway",
    "accessory_front_sway": "ParamAccessoryFrontSway",
    "body_breath_phys": "ParamBodyBreathPhys"
  },
  "hit_areas": [
    { "id": "HitAreaHead", "role": "head", "bound_to_part": "face_base" },
    { "id": "HitAreaBody", "role": "body", "bound_to_part": "torso" },
    { "id": "HitAreaHip", "role": "body", "bound_to_part": "hip" }
  ]
}
