{
  "schema_version": "v1",
  "id": "tpl.base.v1.mao_pro",
  "version": "1.0.0",
  "display_name": {
    "en": "Mao Pro (Nijiiro)",
    "ko": "니지이로 마오 프로",
    "ja": "ニジイロ マオ プロ"
  },
  "intended_vibe": "Nijiiro Mao Pro (Live2D Inc.) 의 Cubism 모델을 wrapper 로 편입한 3rd-party 프리셋. 런타임 렌더링은 원본 .moc3 를 Cubism Framework 가 직접 해석. texture 교체 + 파라미터 I/O 는 wrapper 메타데이터로 수행.",
  "family": "custom",
  "canvas": {
    "width": 4096,
    "height": 4096
  },
  "ratio": {
    "head_to_body": "1:1"
  },
  "parameters_file": "parameters.json",
  "parts_dir": "parts/",
  "deformers_file": "deformers.json",
  "physics_file": "physics/physics.json",
  "motions_dir": "motions/",
  "expressions_dir": "expressions/",
  "test_poses_file": "test_poses/validation_set.json",
  "lipsync_mapping": "../../shared/lipsync_mapping.v1.json",
  "physics_preset": "normal",
  "authoring": {
    "authors": [
      {
        "name": "Live2D Inc.",
        "role": "artist",
        "contact": "n/a"
      }
    ],
    "created_at": "2026-04-24T07:59:58Z",
    "tool": "import-cubism-preset.mjs@0.1.0"
  },
  "compat": {
    "motion_packs": [
      "mao.mtn_01@^1",
      "mao.mtn_02@^1",
      "mao.mtn_03@^1",
      "mao.mtn_04@^1",
      "mao.special_01@^1",
      "mao.special_02@^1",
      "mao.special_03@^1"
    ],
    "expression_packs": [
      "expression.exp_01@^1",
      "expression.exp_02@^1",
      "expression.exp_03@^1",
      "expression.exp_04@^1",
      "expression.exp_05@^1",
      "expression.exp_06@^1",
      "expression.exp_07@^1",
      "expression.exp_08@^1"
    ],
    "physics": "physics.v1",
    "export_targets_supported": [
      "cubism@3"
    ]
  },
  "cubism_mapping": {
    "angle_x": "ParamAngleX",
    "angle_y": "ParamAngleY",
    "angle_z": "ParamAngleZ",
    "cheek": "ParamCheek",
    "face_ink_on": "ParamFaceInkOn",
    "eye_l_open": "ParamEyeLOpen",
    "eye_l_smile": "ParamEyeLSmile",
    "eye_l_form": "ParamEyeLForm",
    "eye_r_open": "ParamEyeROpen",
    "eye_r_smile": "ParamEyeRSmile",
    "eye_r_form": "ParamEyeRForm",
    "eye_ball_x": "ParamEyeBallX",
    "eye_ball_y": "ParamEyeBallY",
    "eye_ball_form": "ParamEyeBallForm",
    "eye_effect": "ParamEyeEffect",
    "brow_l_y": "ParamBrowLY",
    "brow_r_y": "ParamBrowRY",
    "brow_l_x": "ParamBrowLX",
    "brow_r_x": "ParamBrowRX",
    "brow_l_angle": "ParamBrowLAngle",
    "brow_r_angle": "ParamBrowRAngle",
    "brow_l_form": "ParamBrowLForm",
    "brow_r_form": "ParamBrowRForm",
    "phoneme_a": "ParamA",
    "phoneme_i": "ParamI",
    "phoneme_u": "ParamU",
    "phoneme_e": "ParamE",
    "phoneme_o": "ParamO",
    "mouth_up": "ParamMouthUp",
    "mouth_down": "ParamMouthDown",
    "mouth_angry": "ParamMouthAngry",
    "mouth_angry_line": "ParamMouthAngryLine",
    "body_angle_x": "ParamBodyAngleX",
    "body_angle_y": "ParamBodyAngleY",
    "body_angle_z": "ParamBodyAngleZ",
    "breath": "ParamBreath",
    "left_shoulder_up": "ParamLeftShoulderUp",
    "right_shoulder_up": "ParamRightShoulderUp",
    "arm_l_a01": "ParamArmLA01",
    "arm_l_a02": "ParamArmLA02",
    "arm_l_a03": "ParamArmLA03",
    "hand_l_a": "ParamHandLA",
    "arm_r_a01": "ParamArmRA01",
    "arm_r_a02": "ParamArmRA02",
    "arm_r_a03": "ParamArmRA03",
    "wand_rotate": "ParamWandRotate",
    "hand_r_a": "ParamHandRA",
    "ink_drop": "ParamInkDrop",
    "ink_drop_rotate": "ParamInkDropRotate",
    "ink_drop_on": "ParamInkDropOn",
    "arm_l_b01": "ParamArmLB01",
    "arm_l_b02": "ParamArmLB02",
    "arm_l_b03": "ParamArmLB03",
    "hand_l_b": "ParamHandLB",
    "hat_form": "ParamHatForm",
    "arm_r_b01": "ParamArmRB01",
    "arm_r_b02": "ParamArmRB02",
    "arm_r_b02_y": "ParamArmRB02Y",
    "arm_r_b03": "ParamArmRB03",
    "hand_r_b": "ParamHandRB",
    "all_x": "ParamAllX",
    "all_y": "ParamAllY",
    "all_rotate": "ParamAllRotate",
    "hair_front": "ParamHairFront",
    "hair_side_l": "ParamHairSideL",
    "hair_side_r": "ParamHairSideR",
    "hair_back": "ParamHairBack",
    "hair_back_r": "ParamHairBackR",
    "hair_back_l": "ParamHairBackL",
    "hair_front_fuwa": "ParamHairFrontFuwa",
    "hair_side_fuwa": "ParamHairSideFuwa",
    "hair_back_fuwa": "ParamHairBackFuwa",
    "wing": "ParamWing",
    "ribbon": "ParamRibbon",
    "hat_brim": "ParamHatBrim",
    "hat_top": "ParamHatTop",
    "accessory1": "ParamAccessory1",
    "accessory2": "ParamAccessory2",
    "string": "ParamString",
    "robe_l": "ParamRobeL",
    "robe_r": "ParamRobeR",
    "robe_fuwa": "ParamRobeFuwa",
    "heart_miss_on": "ParamHeartMissOn",
    "heart_back_miss_on": "ParamHeartBackMissOn",
    "heart_color_rainbow": "ParamHeartColorRainbow",
    "heart_heal_on": "ParamHeartHealOn",
    "heart_back_heal_on": "ParamHeartBackHealOn",
    "heart_color_heal": "ParamHeartColorHeal",
    "heart_drow": "ParamHeartDrow",
    "heart_size": "ParamHeartSize",
    "heart_color_light": "ParamHeartColorLight",
    "wand_ink_color_rainbow": "ParamWandInkColorRainbow",
    "wand_ink_color_heal": "ParamWandInkColorHeal",
    "wand_ink": "ParamWandInk",
    "smoke_on": "ParamSmokeOn",
    "smoke": "ParamSmoke",
    "explosion_charge_on": "ParamExplosionChargeOn",
    "explosion_light_charge": "ParamExplosionLightCharge",
    "explosion_on": "ParamExplosionOn",
    "explosion": "ParamExplosion",
    "rabbit_elimination": "ParamRabbitElimination",
    "rabbit_appearance": "ParamRabbitAppearance",
    "rabbit_size": "ParamRabbitSize",
    "rabbit_draworder": "ParamRabbitDraworder",
    "rabbit_ear": "ParamRabbitEar",
    "rabbit_direction": "ParamRabbitDirection",
    "rabbit_light": "ParamRabbitLight",
    "rabbit_light_size": "ParamRabbitLightSize",
    "rabbit_x": "ParamRabbitX",
    "rabbit_y": "ParamRabbitY",
    "rabbit_rotate": "ParamRabbitRotate",
    "aura_on": "ParamAuraOn",
    "aura": "ParamAura",
    "aura_color1": "ParamAuraColor1",
    "aura_color2": "ParamAuraColor2",
    "heart_light_on": "ParamHeartLightOn",
    "heart_light": "ParamHeartLight",
    "heart_light_color": "ParamHeartLightColor",
    "heal_light_on": "ParamHealLightOn",
    "heal_light": "ParamHealLight",
    "strengthen_light_on": "ParamStrengthenLightOn",
    "strengthen_light": "ParamStrengthenLight",
    "strengthen_light_move": "ParamStrengthenLightMove",
    "magic_position_x": "ParamMagicPositionX",
    "magic_position_y": "ParamMagicPositionY",
    "all_color1": "ParamAllColor1",
    "all_color2": "ParamAllColor2",
    "rabbit_elimination_effect": "ParamRabbitEliminationEffect"
  },
  "origin": {
    "kind": "third-party",
    "vendor": "Live2D Inc.",
    "product": "Nijiiro Mao Pro",
    "source_path": "mao_pro_ko/runtime",
    "license_ref": "mao_pro_ko/ReadMe.txt",
    "runtime_assets_dir": "runtime_assets/"
  }
}
